[
  {
    "record_id": "ev-cn-miit-2024-02-batch",
    "software_name": "工信部 APP/SDK 行为通报样本（2024年第2批）",
    "publisher": "不适用（批次级移动端行为证据）",
    "aliases": [],
    "source_type": "public_regulatory_notice",
    "source_name": "工信部信息通信管理局",
    "source_url": "https://www.miit.gov.cn/xwdt/gxdt/sjdt/art/2024/art_424e1faa0479457689f7a49e113a5429.html",
    "source_title": "关于侵害用户权益行为的APP（SDK）通报（2024年第2批，总第37批）",
    "source_date": "2024-03-14",
    "evidence_summary": "官方通报说明抽查发现移动 APP/SDK 存在摇一摇乱跳转、信息窗口无法关闭及违规收集使用个人信息等问题；本记录不保存具体应用名单，也不映射 Windows 软件。",
    "behavior_categories": ["ad_popup", "malicious_collection", "other_user_rights_violation"],
    "jurisdiction": "CN",
    "language": "zh-CN",
    "review_status": "approved_for_explanation",
    "confidence": 0.65,
    "false_positive_risk": "high",
    "execution_authorized": false,
    "license_note": "工信部公开页面；仅存引用元数据和克制摘要，不复制附件名单。",
    "evidence_scope": "explanation",
    "mapping_type": "analogical_behavior",
    "is_synthetic": false,
    "entity_scope": "mobile_app",
    "relation_confidence": "high",
    "analogy_basis": "移动端乱跳转、弹窗和个人信息行为只用于解释 Windows 端可能需要复核的行为类别，不能识别具体 Windows 实体。"
  },
  {
    "record_id": "ev-cn-miit-2024-08-batch",
    "software_name": "工信部 APP/SDK 行为通报样本（2024年第8批）",
    "publisher": "不适用（批次级移动端行为证据）",
    "aliases": [],
    "source_type": "public_regulatory_notice",
    "source_name": "工信部信息通信管理局",
    "source_url": "https://www.miit.gov.cn/jgsj/xgj/gzdt/art/2024/art_7471539a36f04791a88ee6a66536f17a.html",
    "source_title": "关于侵害用户权益行为的APP（SDK）通报（2024年第8批，总第43批）",
    "source_date": "2024-09-29",
    "evidence_summary": "官方通报说明抽查发现移动 APP/SDK 存在侵害用户权益行为；记录只保留批次级监管事实，不复刻名单，不指控同名 Windows 程序。",
    "behavior_categories": ["malicious_collection", "other_user_rights_violation"],
    "jurisdiction": "CN",
    "language": "zh-CN",
    "review_status": "approved_for_explanation",
    "confidence": 0.6,
    "false_positive_risk": "high",
    "execution_authorized": false,
    "license_note": "工信部公开页面；仅存引用元数据和克制摘要，不复制附件名单。",
    "evidence_scope": "explanation",
    "mapping_type": "analogical_behavior",
    "is_synthetic": false,
    "entity_scope": "mobile_sdk",
    "relation_confidence": "high",
    "analogy_basis": "移动 APP/SDK 合规问题只能作为用户权益与隐私风险的行为类比，不是 Windows 软件身份信号。"
  },
  {
    "record_id": "ev-cn-miit-2025-03-batch",
    "software_name": "工信部 APP/SDK 行为通报样本（2025年第3批）",
    "publisher": "不适用（批次级移动端行为证据）",
    "aliases": [],
    "source_type": "public_regulatory_notice",
    "source_name": "工信部信息通信管理局",
    "source_url": "https://www.miit.gov.cn/jgsj/xgj/gzdt/art/2025/art_eb31dd22d04a4658b912871c090274bd.html",
    "source_title": "关于侵害用户权益行为的APP（SDK）通报（2025年第3批，总第48批）",
    "source_date": "2025-06-26",
    "evidence_summary": "官方通报说明针对 APP、SDK 违法违规收集使用个人信息开展治理并公布抽查批次；记录不保存具体应用实体，也不跨平台形成黑名单。",
    "behavior_categories": ["malicious_collection", "other_user_rights_violation"],
    "jurisdiction": "CN",
    "language": "zh-CN",
    "review_status": "approved_for_explanation",
    "confidence": 0.6,
    "false_positive_risk": "high",
    "execution_authorized": false,
    "license_note": "工信部公开页面；仅存引用元数据和克制摘要，不复制附件名单。",
    "evidence_scope": "explanation",
    "mapping_type": "analogical_behavior",
    "is_synthetic": false,
    "entity_scope": "mobile_sdk",
    "relation_confidence": "high",
    "analogy_basis": "移动 APP/SDK 个人信息问题可作为隐私过度行为分类参考，但不能映射到 Windows 软件或发布者。"
  },
  {
    "record_id": "ev-cn-miit-2025-05-batch",
    "software_name": "工信部 APP 行为通报样本（2025年第5批）",
    "publisher": "不适用（批次级移动端行为证据）",
    "aliases": [],
    "source_type": "public_regulatory_notice",
    "source_name": "工信部信息通信管理局",
    "source_url": "https://wap.miit.gov.cn/xwfb/gxdt/sjdt/art/2025/art_b261d87bc4be4b24bde196e2d313af76.html",
    "source_title": "关于侵害用户权益行为的APP通报（2025年第5批，总第50批）",
    "source_date": "2025-09-18",
    "evidence_summary": "官方通报说明对 APP 违法违规收集使用个人信息开展治理并公布抽查批次；本记录仅表示移动端行为来源，不保存具体软件指控。",
    "behavior_categories": ["malicious_collection", "other_user_rights_violation"],
    "jurisdiction": "CN",
    "language": "zh-CN",
    "review_status": "approved_for_explanation",
    "confidence": 0.6,
    "false_positive_risk": "high",
    "execution_authorized": false,
    "license_note": "工信部公开页面；仅存引用元数据和克制摘要，不复制附件名单。",
    "evidence_scope": "explanation",
    "mapping_type": "analogical_behavior",
    "is_synthetic": false,
    "entity_scope": "mobile_app",
    "relation_confidence": "high",
    "analogy_basis": "移动 APP 用户权益问题只用于解释通用风险类别，不是 Windows direct_entity 或 publisher-level 结论。"
  },
  {
    "record_id": "ev-cn-miit-2026-01-batch",
    "software_name": "工信部 APP/SDK 行为通报样本（2026年第1批）",
    "publisher": "不适用（批次级移动端行为证据）",
    "aliases": [],
    "source_type": "public_regulatory_notice",
    "source_name": "工信部信息通信管理局",
    "source_url": "https://www.miit.gov.cn/jgsj/xgj/fwjd/art/2026/art_b79fa724b5f547429248911e20acb6a3.html",
    "source_title": "关于侵害用户权益行为的APP（SDK）通报（2026年第1批，总第54批）",
    "source_date": "2026-01-06",
    "evidence_summary": "官方通报说明抽查发现 APP 及 SDK 存在侵害用户权益行为；本记录保留批次级来源追溯，不复制名单、不生成具体软件 verdict。",
    "behavior_categories": ["malicious_collection", "other_user_rights_violation"],
    "jurisdiction": "CN",
    "language": "zh-CN",
    "review_status": "approved_for_explanation",
    "confidence": 0.6,
    "false_positive_risk": "high",
    "execution_authorized": false,
    "license_note": "工信部公开页面；仅存引用元数据和克制摘要，不复制附件名单。",
    "evidence_scope": "explanation",
    "mapping_type": "analogical_behavior",
    "is_synthetic": false,
    "entity_scope": "mobile_sdk",
    "relation_confidence": "high",
    "analogy_basis": "移动 APP/SDK 行为证据只进入 explanation/review，不能替代 Windows 本地身份和行为证据。"
  }
]
