[
  {"record_id": "ev-real-ms-installcore", "software_name": "PUA:Win32/InstallCore", "publisher": "Unknown (Microsoft detection family)", "aliases": [], "source_type": "public_vendor_behavior_article", "source_name": "Microsoft Security Intelligence", "source_url": "https://www.microsoft.com/en-us/wdsi/threats/malware-encyclopedia-description?Name=PUA%3AWin32%2FInstallCore", "source_title": "PUA:Win32/InstallCore threat description - Microsoft Security Intelligence", "source_date": "2015-03-11", "evidence_summary": "Microsoft 页面描述该 Windows PUA 家族可能捆绑非预期软件、修改浏览器设置与快捷方式，并安装浏览器扩展；本记录仅复述页面中的行为范围。", "behavior_categories": ["forced_installation", "browser_hijacking", "malicious_bundling"], "jurisdiction": "global", "language": "en-US", "review_status": "approved_for_explanation", "confidence": 0.8, "false_positive_risk": "medium", "execution_authorized": false, "license_note": "Public Microsoft page; store citation metadata and a short Chinese paraphrase only.", "evidence_scope": "review", "mapping_type": "direct_entity", "is_synthetic": false, "entity_scope": "windows_desktop_software", "relation_confidence": "high"},
  {"record_id": "ev-real-ms-fusioncore", "software_name": "PUA:Win32/FusionCore", "publisher": "Unknown (Microsoft detection family)", "aliases": [], "source_type": "public_vendor_behavior_article", "source_name": "Microsoft Security Intelligence", "source_url": "https://www.microsoft.com/en-us/wdsi/threats/malware-encyclopedia-description?Name=PUA%3AWin32%2FFusionCore", "source_title": "PUA:Win32/FusionCore threat description - Microsoft Security Intelligence", "source_date": "2016-06-28", "evidence_summary": "Microsoft 页面将该 Windows PUA 家族描述为 bundling software，并说明其可能安装其他潜在不需要的应用；本记录不推断具体安装实例。", "behavior_categories": ["malicious_bundling"], "jurisdiction": "global", "language": "en-US", "review_status": "approved_for_explanation", "confidence": 0.75, "false_positive_risk": "medium", "execution_authorized": false, "license_note": "Public Microsoft page; store citation metadata and a short Chinese paraphrase only.", "evidence_scope": "review", "mapping_type": "direct_entity", "is_synthetic": false, "entity_scope": "windows_desktop_software", "relation_confidence": "high"},
  {"record_id": "ev-real-ms-slimware", "software_name": "PUA:Win32/Slimware", "publisher": "Unknown (Microsoft detection family)", "aliases": [], "source_type": "public_vendor_behavior_article", "source_name": "Microsoft Security Intelligence", "source_url": "https://www.microsoft.com/en-us/wdsi/threats/malware-encyclopedia-description?Name=PUA%3AWin32%2FSlimware", "source_title": "PUA:Win32/Slimware threat description - Microsoft Security Intelligence", "source_date": "2017-02-08", "evidence_summary": "Microsoft 页面描述该 Windows PUA 家族展示可疑问题并要求付费修复、在应用外显示广告，并可能捆绑安装其他应用。", "behavior_categories": ["ad_popup", "malicious_bundling", "other_user_rights_violation"], "jurisdiction": "global", "language": "en-US", "review_status": "approved_for_explanation", "confidence": 0.78, "false_positive_risk": "medium", "execution_authorized": false, "license_note": "Public Microsoft page; store citation metadata and a short Chinese paraphrase only.", "evidence_scope": "review", "mapping_type": "direct_entity", "is_synthetic": false, "entity_scope": "windows_desktop_software", "relation_confidence": "high"},
  {"record_id": "ev-real-ms-piriformbundler", "software_name": "PUA:Win32/PiriformBundler", "publisher": "Piriform", "aliases": [], "source_type": "public_vendor_behavior_article", "source_name": "Microsoft Security Intelligence", "source_url": "https://www.microsoft.com/en-us/wdsi/threats/malware-encyclopedia-description?Name=PUA%3AWin32%2FPiriformBundler", "source_title": "PUA:Win32/PiriformBundler threat description - Microsoft Security Intelligence", "source_date": "2020-07-27", "evidence_summary": "Microsoft 页面仅针对被识别为该 PUA detection family 的特定安装器，描述其捆绑其他提供方软件的行为；不把 Piriform 产品整体标记为 PUA。", "behavior_categories": ["malicious_bundling"], "jurisdiction": "global", "language": "en-US", "review_status": "approved_for_explanation", "confidence": 0.7, "false_positive_risk": "high", "execution_authorized": false, "license_note": "Public Microsoft page; store citation metadata and a short Chinese paraphrase only.", "evidence_scope": "explanation", "mapping_type": "direct_entity", "is_synthetic": false, "entity_scope": "windows_desktop_software", "relation_confidence": "medium"},
  {"record_id": "ev-real-ms-mediaarena", "software_name": "PUA:Win32/MediaArena", "publisher": "Unknown (Microsoft detection family)", "aliases": [], "source_type": "public_vendor_behavior_article", "source_name": "Microsoft Security Intelligence", "source_url": "https://www.microsoft.com/en-us/wdsi/threats/malware-encyclopedia-description?Name=PUA%3AWin32%2FMediaArena&threatId=359463", "source_title": "PUA:Win32/MediaArena threat description - Microsoft Security Intelligence", "source_date": "2023-03-20", "evidence_summary": "Microsoft 页面描述该 Windows PUA 家族可能修改浏览器设置、重定向搜索并收集搜索查询；记录不声称同名普通文件必然属于该家族。", "behavior_categories": ["browser_hijacking", "malicious_collection"], "jurisdiction": "global", "language": "en-US", "review_status": "approved_for_explanation", "confidence": 0.8, "false_positive_risk": "medium", "execution_authorized": false, "license_note": "Public Microsoft page; store citation metadata and a short Chinese paraphrase only.", "evidence_scope": "review", "mapping_type": "direct_entity", "is_synthetic": false, "entity_scope": "windows_desktop_software", "relation_confidence": "high"}
]
