[
  {"record_id":"ev-syn-direct","software_name":"Example Synthetic Desktop App","publisher":"Example Publisher","aliases":["Example Desktop"],"source_type":"synthetic_example","source_name":"PC CleanGuard Synthetic Evidence","source_url":"https://example.invalid/evidence/direct","source_title":"Synthetic direct entity example","source_date":"2026-07-12","evidence_summary":"用于测试 Windows direct entity review 边界。","behavior_categories":["ad_popup"],"jurisdiction":"CN","language":"zh-CN","review_status":"approved_for_explanation","confidence":0.7,"false_positive_risk":"high","execution_authorized":false,"license_note":"Synthetic test data","evidence_scope":"review","mapping_type":"direct_entity","is_synthetic":true,"entity_scope":"windows_desktop_software","relation_confidence":"high"},
  {"record_id":"ev-syn-analogy","software_name":"Example Mobile Behavior Analogy","publisher":"Example Publisher","aliases":["Example Analogy"],"source_type":"synthetic_example","source_name":"PC CleanGuard Synthetic Evidence","source_url":"https://example.invalid/evidence/analogy","source_title":"Synthetic mobile behavior analogy","source_date":"2026-07-12","evidence_summary":"移动端行为仅用于类比风险提示。","behavior_categories":["browser_hijacking","ad_popup"],"jurisdiction":"CN","language":"zh-CN","review_status":"needs_human_review","confidence":0.4,"false_positive_risk":"high","execution_authorized":false,"license_note":"Synthetic test data","evidence_scope":"risk_hint","mapping_type":"analogical_behavior","is_synthetic":true,"entity_scope":"mobile_app","relation_confidence":"low","analogy_basis":"移动 APP 弹窗骚扰/误导跳转 → 类比 Windows adware/browser_hijack 风险提示"},
  {"record_id":"ev-syn-publisher","software_name":"Example Publisher Family","publisher":"Example Publisher","aliases":[],"source_type":"synthetic_example","source_name":"PC CleanGuard Synthetic Evidence","source_url":"https://example.invalid/evidence/publisher","source_title":"Synthetic publisher-level warning","source_date":"2026-07-12","evidence_summary":"发布者级线索不能映射到具体软件执行建议。","behavior_categories":["malicious_bundling"],"jurisdiction":"CN","language":"zh-CN","review_status":"needs_human_review","confidence":0.3,"false_positive_risk":"high","execution_authorized":false,"license_note":"Synthetic test data","evidence_scope":"review","mapping_type":"related_publisher","is_synthetic":true,"entity_scope":"publisher_level","relation_confidence":"medium"},
  {"record_id":"ev-syn-collision","software_name":"Example Common Name","publisher":"Unknown Example Publisher","aliases":["Example Helper"],"source_type":"synthetic_example","source_name":"PC CleanGuard Synthetic Evidence","source_url":"https://example.invalid/evidence/collision","source_title":"Synthetic name collision candidate","source_date":"2026-07-12","evidence_summary":"同名候选必须降低置信度并人工复核。","behavior_categories":["difficult_uninstall"],"jurisdiction":"CN","language":"zh-CN","review_status":"needs_human_review","confidence":0.5,"false_positive_risk":"high","execution_authorized":false,"license_note":"Synthetic test data","evidence_scope":"sorting","mapping_type":"name_collision_candidate","is_synthetic":true,"entity_scope":"unknown","relation_confidence":"unknown"}
]
